Request ID,Feature Title,Description,Product,Request Channel,Customer Type,Priority,Status,Type,Requested By,Request Date,Business Value,Implementation Complexity,Customer Impact
FR-142,Neural Interface Support,"Research neural interface integration",Ada,Innovation Lab,Enterprise,Low,Experimental,Innovation,Innovation Lead,2024-05-21,Low,High,Low
FR-143,Automated Deployment,"Implement AI-powered deployment system",Ada,DevOps Team,All,Critical,Planned,DevOps,DevOps Lead,2024-05-22,High,High,High
FR-144,Quantum Data Analysis,"Add quantum computing for data analysis",Ada,Data Team,Enterprise,Medium,Research,Analytics,Data Scientist,2024-05-23,High,High,Medium
FR-145,Automated UX Testing,"Use AI for UX testing automation",Ada,UX Team,All,High,Open,Testing,UX Designer,2024-05-24,High,Medium,High
FR-146,Brain Signal Processing,"Add brain signal processing capabilities",Ada,Innovation Lab,Enterprise,Low,Experimental,Innovation,Innovation Lead,2024-05-25,Low,High,Low
FR-147,Automated Security Patching,"Implement automated security updates",Ada,Security Team,All,Critical,Planned,Security,Security Team,2024-05-26,High,Medium,High
FR-148,Quantum Encryption Keys,"Generate quantum-safe encryption keys",Ada,Security Team,Enterprise,High,Research,Security,Security Team,2024-05-27,High,High,Medium
FR-149,Automated UI Testing,"Implement AI-driven UI testing",Ada,QA Team,All,High,Open,Testing,QA Lead,2024-05-28,High,Medium,High
FR-150,Neural Network Training,"Add neural network training capabilities",Ada,Data Team,Enterprise,Critical,Planned,AI,Data Scientist,2024-05-29,High,High,High
FR-151,Automated Performance Optimization,"Implement AI-driven performance tuning",Ada,Technical Team,All,High,Open,Performance,Technical Lead,2024-05-30,High,Medium,High
FR-152,Quantum Algorithm Support,"Add quantum algorithm implementation",Ada,Technical Team,Enterprise,Medium,Research,Development,Technical Lead,2024-05-31,High,High,Medium
FR-153,Automated Stress Testing,"Use AI for stress test automation",Ada,QA Team,All,High,Planned,Testing,QA Lead,2024-06-01,High,Medium,High
FR-154,Brain Pattern Recognition,"Implement brain pattern analysis",Ada,Innovation Lab,Enterprise,Low,Experimental,Innovation,Innovation Lead,2024-06-02,Low,High,Low
FR-155,Automated Vulnerability Scanning,"Add AI-powered security scanning",Ada,Security Team,All,Critical,Open,Security,Security Team,2024-06-03,High,Medium,High
FR-156,Quantum Data Encryption,"Implement quantum data encryption",Ada,Security Team,Enterprise,High,Research,Security,Security Team,2024-06-04,High,High,Medium
FR-157,Automated Integration Testing,"Add AI-driven integration testing",Ada,QA Team,All,High,Planned,Testing,QA Lead,2024-06-05,High,Medium,High
FR-158,Neural Data Processing,"Implement neural data analysis",Ada,Data Team,Enterprise,Medium,Research,Analytics,Data Scientist,2024-06-06,High,High,Medium
FR-159,Automated Resource Scaling,"Add AI-powered resource management",Ada,DevOps Team,All,Critical,Open,DevOps,DevOps Lead,2024-06-07,High,Medium,High
FR-160,Quantum Computing Framework,"Create quantum computing framework",Ada,Technical Team,Enterprise,High,Research,Development,Technical Lead,2024-06-08,High,High,Medium
FR-161,Automated Regression Testing,"Implement AI-driven regression testing",Ada,QA Team,All,High,Planned,Testing,QA Lead,2024-06-09,High,Medium,High
FR-162,Brain Wave Monitoring,"Add brain wave analysis capabilities",Ada,Innovation Lab,Enterprise,Low,Experimental,Innovation,Innovation Lead,2024-06-10,Low,High,Low
FR-163,Automated Security Monitoring,"Implement AI-powered security monitoring",Ada,Security Team,All,Critical,Open,Security,Security Team,2024-06-11,High,Medium,High
FR-164,Quantum Error Correction,"Add quantum error correction support",Ada,Technical Team,Enterprise,High,Research,Development,Technical Lead,2024-06-12,High,High,Medium
FR-165,Automated Performance Testing,"Implement AI-driven performance testing",Ada,QA Team,All,High,Planned,Testing,QA Lead,2024-06-13,High,Medium,High
FR-166,Neural Network Visualization,"Add neural network visualization tools",Ada,Data Team,Enterprise,Medium,Research,Analytics,Data Scientist,2024-06-14,High,High,Medium
FR-167,Automated Capacity Planning,"Implement AI-powered capacity planning",Ada,DevOps Team,All,Critical,Open,DevOps,DevOps Lead,2024-06-15,High,Medium,High
FR-168,Quantum Data Storage,"Add quantum data storage support",Ada,Technical Team,Enterprise,High,Research,Storage,Technical Lead,2024-06-16,High,High,Medium
FR-169,Automated Security Testing,"Implement AI-driven security testing",Ada,Security Team,All,Critical,Planned,Security,Security Team,2024-06-17,High,Medium,High
FR-170,Brain Signal Analysis,"Add brain signal analysis capabilities",Ada,Innovation Lab,Enterprise,Low,Experimental,Innovation,Innovation Lead,2024-06-18,Low,High,Low
FR-171,Automated Performance Monitoring,"Implement AI-powered performance monitoring",Ada,Technical Team,All,High,Open,Performance,Technical Lead,2024-06-19,High,Medium,High
FR-172,Quantum Network Protocol,"Add quantum network protocol support",Ada,Technical Team,Enterprise,High,Research,Networking,Technical Lead,2024-06-20,High,High,Medium
FR-173,Automated Load Balancing,"Implement AI-driven load balancing",Ada,DevOps Team,All,Critical,Planned,DevOps,DevOps Lead,2024-06-21,High,Medium,High
FR-174,Neural Data Visualization,"Add neural data visualization tools",Ada,Data Team,Enterprise,Medium,Research,Analytics,Data Scientist,2024-06-22,High,High,Medium
FR-175,Automated Resource Optimization,"Implement AI-powered resource optimization",Ada,DevOps Team,All,Critical,Open,DevOps,DevOps Lead,2024-06-23,High,Medium,High
FR-176,Quantum Algorithm Library,"Create quantum algorithm library",Ada,Technical Team,Enterprise,High,Research,Development,Technical Lead,2024-06-24,High,High,Medium
FR-177,Automated Security Analysis,"Implement AI-driven security analysis",Ada,Security Team,All,Critical,Planned,Security,Security Team,2024-06-25,High,Medium,High
FR-178,Brain Computer Interface,"Add brain computer interface support",Ada,Innovation Lab,Enterprise,Low,Experimental,Innovation,Innovation Lead,2024-06-26,Low,High,Low
FR-179,Automated Performance Analysis,"Implement AI-powered performance analysis",Ada,Technical Team,All,High,Open,Performance,Technical Lead,2024-06-27,High,Medium,High
FR-180,Quantum Cryptography,"Add quantum cryptography support",Ada,Security Team,Enterprise,High,Research,Security,Security Team,2024-06-28,High,High,Medium
FR-181,Automated Testing Framework,"Create AI-powered testing framework",Ada,QA Team,All,Critical,Planned,Testing,QA Lead,2024-06-29,High,Medium,High
FR-182,Neural Network Library,"Create neural network algorithm library",Ada,Data Team,Enterprise,High,Research,Development,Data Scientist,2024-06-30,High,High,Medium
FR-183,Automated Infrastructure Management,"Implement AI-powered infrastructure management",Ada,DevOps Team,All,Critical,Open,DevOps,DevOps Lead,2024-07-01,High,Medium,High
FR-184,Quantum Machine Learning Library,"Create quantum ML algorithm library",Ada,Data Team,Enterprise,High,Research,Development,Data Scientist,2024-07-02,High,High,Medium
FR-185,Automated Security Framework,"Create AI-powered security framework",Ada,Security Team,All,Critical,Planned,Security,Security Team,2024-07-03,High,Medium,High
FR-186,Brain Wave Interface,"Add brain wave interface support",Ada,Innovation Lab,Enterprise,Low,Experimental,Innovation,Innovation Lead,2024-07-04,Low,High,Low
FR-187,Automated Performance Framework,"Create AI-powered performance framework",Ada,Technical Team,All,High,Open,Performance,Technical Lead,2024-07-05,High,Medium,High
FR-188,Quantum Computing Library,"Create quantum computing library",Ada,Technical Team,Enterprise,High,Research,Development,Technical Lead,2024-07-06,High,High,Medium
FR-189,Automated Testing Platform,"Create AI-powered testing platform",Ada,QA Team,All,Critical,Planned,Testing,QA Lead,2024-07-07,High,Medium,High
FR-190,Neural Interface Library,"Create neural interface library",Ada,Innovation Lab,Enterprise,Medium,Research,Development,Innovation Lead,2024-07-08,High,High,Medium
FR-191,Automated DevOps Platform,"Create AI-powered DevOps platform",Ada,DevOps Team,All,Critical,Open,DevOps,DevOps Lead,2024-07-09,High,Medium,High
FR-192,Quantum Development Kit,"Create quantum development toolkit",Ada,Technical Team,Enterprise,High,Research,Development,Technical Lead,2024-07-10,High,High,Medium
FR-193,Automated Security Platform,"Create AI-powered security platform",Ada,Security Team,All,Critical,Planned,Security,Security Team,2024-07-11,High,Medium,High
FR-194,Brain Interface Library,"Create brain interface library",Ada,Innovation Lab,Enterprise,Low,Experimental,Innovation,Innovation Lead,2024-07-12,Low,High,Low
FR-195,Automated Performance Platform,"Create AI-powered performance platform",Ada,Technical Team,All,High,Open,Performance,Technical Lead,2024-07-13,High,Medium,High
FR-196,Quantum Security Library,"Create quantum security library",Ada,Security Team,Enterprise,High,Research,Security,Security Team,2024-07-14,High,High,Medium
FR-197,Automated Testing Library,"Create AI-powered testing library",Ada,QA Team,All,Critical,Planned,Testing,QA Lead,2024-07-15,High,Medium,High
FR-198,Neural Computing Library,"Create neural computing library",Ada,Data Team,Enterprise,High,Research,Development,Data Scientist,2024-07-16,High,High,Medium
FR-199,Automated Platform Management,"Create AI-powered platform management",Ada,DevOps Team,All,Critical,Open,DevOps,DevOps Lead,2024-07-17,High,Medium,High
FR-200,Quantum Integration Framework,"Create quantum integration framework",Ada,Technical Team,Enterprise,High,Research,Integration,Technical Lead,2024-07-18,High,High,Medium